{
  "protocolVersion": 2,
  "type": "command",
  "commandId": "cmd-mutation-01J0000000000000000",
  "jobId": "job-01J000000000000000000000",
  "runtimeId": "runtime-01J00000000000000000000000",
  "connectionId": "connection-01J00000000000000000",
  "revitInstanceId": "revit-01J00000000000000000000",
  "routeGeneration": 3,
  "leaseEpoch": 7,
  "stateVersion": 8,
  "documentFingerprint": "doc-fingerprint-0000000000000001",
  "tool": "create_wall",
  "args": {
    "levelId": "42",
    "walls": [
      {
        "startPoint": {
          "x": 0,
          "y": 0
        },
        "endPoint": {
          "x": 12192,
          "y": 0
        }
      }
    ]
  },
  "payloadHash": "731adce57d0761f083ecaca8eb223b60b785f1df4c756bc47587f2903a7bc1b5",
  "deadlineUnixMs": 1785071040000,
  "mutationClass": "mutation",
  "planId": "plan-3bhk-001",
  "planRevision": 2,
  "planFingerprint": "726a0230b5f1f702aa7633311dbf22932f9a74bf14b8b3bf817449793f33be99",
  "stepId": "step-wall",
  "idempotencyKey": "idem-01J000000000000000000000",
  "sessionTag": "session-01J0000000000000000000",
  "executionSnapshotId": "snapshot-01J0000000000000000000",
  "executionSnapshotHash": "103e9eb6317100c8fb4352d077a5ea93fd410479b17319fff237a381794040e6",
  "stepAuthorization": {
    "algorithm": "Ed25519",
    "issuer": "https://www.datumm.ai",
    "kid": "fixture-ed25519-rfc8032-1",
    "jti": "step-auth-01J000000000000000000",
    "userSubject": "user_fixture_001",
    "desktopDeviceId": "desktop-device-001",
    "runtimeId": "runtime-01J00000000000000000000000",
    "jobId": "job-01J000000000000000000000",
    "revitInstanceId": "revit-01J00000000000000000000",
    "documentFingerprint": "doc-fingerprint-0000000000000001",
    "leaseEpoch": 7,
    "executionSnapshotId": "snapshot-01J0000000000000000000",
    "executionSnapshotHash": "103e9eb6317100c8fb4352d077a5ea93fd410479b17319fff237a381794040e6",
    "planId": "plan-3bhk-001",
    "planRevision": 2,
    "planFingerprint": "726a0230b5f1f702aa7633311dbf22932f9a74bf14b8b3bf817449793f33be99",
    "stepId": "step-wall",
    "tool": "create_wall",
    "payloadHash": "731adce57d0761f083ecaca8eb223b60b785f1df4c756bc47587f2903a7bc1b5",
    "issuedAt": "2026-07-26T12:00:00.000Z",
    "expiresAt": "2026-07-26T12:10:00.000Z",
    "signature": "7ytQ8dR2jgF-aZjiSP-pRGHurGfUDvaUpeZq7nBrtPyfe3HpdkixuWhegbkm96ThNTTMFyhL1Pq3q8bTep41Ag"
  }
}
